{
  "recipient_role_assignment": {
    "entity_type": "role_assignment",
    "entity_id": "role-assignment-executor-001",
    "entity_version": 1
  },
  "team_plan": {
    "entity_type": "team_plan",
    "entity_id": "team-plan-pump-001",
    "entity_version": 1
  },
  "task": {
    "entity_type": "task",
    "entity_id": "task-driver-selection-001",
    "entity_version": 1
  },
  "fields": [
    "available_supply_voltage",
    "user_skill_level"
  ],
  "purpose": {
    "code": "adapt_component_explanation",
    "description": "Use only the listed fields to evaluate compatibility and adapt the explanation to the user."
  },
  "classification": "internal",
  "processing_mode": "external_allowed",
  "onward_sharing": "prohibited",
  "valid_from": "2026-08-04T15:12:00Z",
  "expires_at": "2026-08-04T16:00:00Z",
  "revocable": true,
  "usage_logging": "required",
  "reliance_policy": "historical_reliance_allowed",
  "status": "active"
}
